百胜餐饮（深圳）有限公司长岭陂餐厅,深圳市,留仙大道长源京基御领公馆2栋半地下215号商铺,
百胜餐饮（深圳）有限公司万象食家K-coffee餐厅,深圳市,园路南侧，桃园路北侧深圳笋岗万象食家KL528,"手机点餐,手机点餐"
百胜餐饮（深圳）有限公司后环餐厅,珠海市,高新区唐家湾镇情侣北路南侧、金云路东侧1层位置编号为102的商铺,
百胜餐饮（深圳）有限公司深纺大厦餐厅,深圳市,振华路2001号深纺大厦一楼L1-16号,
百胜餐饮（深圳）有限公司万象食家餐厅,深圳市,园路南侧，桃园路北侧深圳笋岗万象食家L408,
百胜餐饮（深圳）有限公司万象食家K-coffee餐厅,深圳市,园路南侧，桃园路北侧深圳笋岗万象食家KL528,"手机点餐,手机点餐"
百胜餐饮（深圳）有限公司万科云城东区餐厅,深圳市,西丽万科云城（三期）9栋177、178号商铺,
百胜餐饮（深圳）有限公司长岭陂餐厅,深圳市,留仙大道长源京基御领公馆2栋半地下215号商铺,
百胜餐饮（深圳）有限公司莲塘高新园K-coffee餐厅,深圳市,罗沙路莲塘工业厂房106栋一层,"手机点餐,手机点餐"
百胜餐饮（深圳）有限公司嘉汇新城餐厅,深圳市,福华路嘉汇新城嘉汇城1层商场8之L115/L116号铺位,
百胜餐饮（深圳）有限公司文博宫餐厅,深圳市,布吉街道文博宫9-141号L1号商铺,
百胜餐饮（深圳）有限公司佳兆业中心餐厅,深圳市,上步南路东南园路北佳兆业中心601第一层103号商铺,
百胜餐饮（深圳）有限公司万象食家餐厅,深圳市,园路南侧，桃园路北侧深圳笋岗万象食家L408,
深圳湾公园站餐厅,深圳市,滨海大道路深圳湾公园地铁商业A13（母店）及B01（外卖点）,"手机点餐,手机点餐"
百胜餐饮（深圳）有限公司后环餐厅,珠海市,高新区唐家湾镇情侣北路南侧、金云路东侧1层位置编号为102的商铺,
百胜餐饮（深圳）有限公司深纺大厦餐厅,深圳市,振华路2001号深纺大厦一楼L1-16号,
百胜餐饮（深圳）有限公司莲塘高新园K-coffee餐厅,深圳市,罗沙路莲塘工业厂房106栋一层,"手机点餐,手机点餐"
百胜餐饮（深圳）有限公司新大梅沙餐厅,深圳市,大梅沙村盐梅路北大梅沙海景酒店5号楼一层,
百胜餐饮（深圳）有限公司新大梅沙餐厅,深圳市,大梅沙村盐梅路北大梅沙海景酒店5号楼一层,
百胜餐饮（深圳）有限公司嘉汇新城餐厅,深圳市,福华路嘉汇新城嘉汇城1层商场8之L115/L116号铺位,
深圳湾公园站餐厅,深圳市,滨海大道路深圳湾公园地铁商业A13（母店）及B01（外卖点）,"手机点餐,手机点餐"
开发区上海路餐厅,南通市,开发区上海路80号利群时代超市一楼,"24小时,24小时,Wi-Fi,Wi-Fi,点唱机,点唱机,店内参观,店内参观,礼品卡,手机点餐,手机点餐"
太仓新区东亭路餐厅,苏州市,太仓市娄江路与县府街交叉口西南侧（太仓新区上海路北、东亭路东地块）万达广场,"Wi-Fi,Wi-Fi,点唱机,点唱机,店内参观,店内参观,礼品卡,手机点餐,手机点餐"
动力南广场（汇金奥特莱斯B1层）餐厅,上海市,石龙路750-3号上海南站地下商场南馆,礼品卡
南广场餐厅,上海市,秣陵路303号上海火车站西南出口一侧,"Wi-Fi,Wi-Fi,礼品卡"
北广场餐厅,上海市,秣陵路303号上海站北广场北立面1F大厅入口西侧位置,"Wi-Fi,Wi-Fi"
南站精选（火车站站内）餐厅,上海市,沪闵路9001号上海南站候车大厅,"精选店,精选店,礼品卡"
上海滩餐厅,上海市,佘山林湖路888号-1上海滩区5号,"Wi-Fi,Wi-Fi,精选店,精选店,礼品卡"
上海南路餐厅,南昌市,青山湖区上海路3号,"Wi-Fi,Wi-Fi,店内参观,店内参观,礼品卡"
福州万象餐厅,福州市,台江区上海街道西环中路691号万象商业广场二层,"Wi-Fi,Wi-Fi,店内参观,店内参观,礼品卡"
上海城84832861餐厅,泰州市,人民西路93号1、2层,"24小时,24小时,Wi-Fi,Wi-Fi,点唱机,点唱机,礼品卡"
南京肯德基有限公司沭阳大润发餐厅,宿迁市,沭阳县上海南路与苏州西路交汇处,"24小时,24小时,Wi-Fi,Wi-Fi,点唱机,点唱机,店内参观,店内参观,礼品卡"
上海路餐厅,锦州市,上海路四段二号,"24小时,24小时,Wi-Fi,Wi-Fi,礼品卡"
上海乳山餐厅餐厅,上海市,乳山路136号,"Wi-Fi,Wi-Fi,店内参观,店内参观,礼品卡,溯源"
新客站餐厅,上海市,秣陵路303号上海站南广场站内一层过安检电梯口旁,"Wi-Fi,Wi-Fi"
上海城餐厅,重庆市,南坪西路上海城一层,"Wi-Fi,Wi-Fi,点唱机,点唱机,礼品卡"
财富中心餐厅,黑河市,上海路与和平街交叉口大润发商业广场一楼肯德基,"Wi-Fi,Wi-Fi,点唱机,点唱机,店内参观,店内参观,礼品卡"
新南广餐厅,上海市,秣陵路303号上海火车站东南出口东侧一层,"Wi-Fi,Wi-Fi,礼品卡"
高铁北精选餐厅,上海市,铁路上海虹桥站出发层商铺号：3F-A3-1,"精选店,精选店,礼品卡"
新上海路餐厅,南昌市,上海北路230号肯德基,"Wi-Fi,Wi-Fi,礼品卡"
南通世茂餐厅,南通市,新东路101号地块（上海东路北、新河东路东）世茂广场大润发超市内,"24小时,24小时,Wi-Fi,Wi-Fi,礼品卡,手机点餐,手机点餐"
国展餐厅,上海市,盈港东路158号国家会展中心（上海）之商业广场一层D-L114号、二层D-L220号 39883261,"Wi-Fi,Wi-Fi"
爱建卓展餐厅,哈尔滨市,上海街99号卓展购物中心二期,"Wi-Fi,Wi-Fi,点唱机,点唱机,店内参观,店内参观"
金光中心餐厅,上海市,东长治路588号上海白玉兰广场商场LG2—M55,"Wi-Fi,Wi-Fi,点唱机,点唱机"
莱西乐好餐厅,青岛市,青岛路东上海路南莱西乐好时代城一层,"Wi-Fi,Wi-Fi,店内参观,店内参观"
南京肯德基有限公司中央广场餐厅,宿迁市,人民中路与上海中路交叉口的沭阳中央广场一层,"Wi-Fi,Wi-Fi"
启东碧桂街区餐厅,南通市,开发区中邦上海城商业一期13幢一层139室、140室、141室,"24小时,24小时,Wi-Fi,Wi-Fi,店内参观,店内参观"
长兴服务区（南）餐厅,湖州市,G50高速长兴服务南区(上海江苏方向),"Wi-Fi,Wi-Fi"
启东凤凰荟餐厅,南通市,开发区中邦上海城商业二期购物中心一层1-004号,"Wi-Fi,Wi-Fi,点唱机,点唱机,店内参观,店内参观,手机点餐,手机点餐"
万象城甜品站餐厅,上海市,吴中路1599号的上海万象城项目L437b号商铺,"Wi-Fi,Wi-Fi"
中环大厦餐厅,银川市,中国上海路与民族街十字东北角中环大厦1层,"Wi-Fi,Wi-Fi,店内参观,店内参观"
万象城甜品站餐厅,上海市,吴中路1599号的上海万象城项目L437b号商铺,"Wi-Fi,Wi-Fi"
德清服务区南餐厅(上海方向）餐厅,湖州市,浙江申嘉湖杭高速公路德清服务区南区(上海方向）,"Wi-Fi,Wi-Fi,店内参观,店内参观"
启东凤凰荟餐厅,南通市,开发区中邦上海城商业二期购物中心一层1-004号,"Wi-Fi,Wi-Fi,点唱机,点唱机,店内参观,店内参观,手机点餐,手机点餐"
中环大厦餐厅,银川市,中国上海路与民族街十字东北角中环大厦1层,"Wi-Fi,Wi-Fi,店内参观,店内参观"
佘山宝地餐厅,上海市,上海佘月路27号一 层 105+107 号,"Wi-Fi,Wi-Fi,点唱机,点唱机"
新化恒太城餐厅,娄底市,上海路东方城市广场1层,"Wi-Fi,Wi-Fi,点唱机,点唱机,店内参观,店内参观"
新化恒太城餐厅,娄底市,上海路东方城市广场1层,"Wi-Fi,Wi-Fi,点唱机,点唱机,店内参观,店内参观"
佘山宝地餐厅,上海市,上海佘月路27号一 层 105+107 号,"Wi-Fi,Wi-Fi,点唱机,点唱机"
德清服务区南餐厅(上海方向）餐厅,湖州市,浙江申嘉湖杭高速公路德清服务区南区(上海方向）,"Wi-Fi,Wi-Fi,店内参观,店内参观"
爱建卓展甜品站餐厅,哈尔滨市,上海路99号,
爱建卓展甜品站餐厅,哈尔滨市,上海路99号,
爱建卓展甜品站餐厅,哈尔滨市,上海路99号,
爱建卓展甜品站餐厅,哈尔滨市,上海路99号,
上海路电话8881002餐厅,十堰市,二堰街办上海路58号1幢1-5书香嘉苑一层,"Wi-Fi,Wi-Fi,点唱机,点唱机,店内参观,店内参观"
上海路电话8881002餐厅,十堰市,二堰街办上海路58号1幢1-5书香嘉苑一层,"Wi-Fi,Wi-Fi,点唱机,点唱机,店内参观,店内参观"
新沂吾悦餐厅,徐州市,上海路与大桥路交叉口新城吾悦广场【1001-1】号商铺,"Wi-Fi,Wi-Fi"
新沂吾悦餐厅,徐州市,上海路与大桥路交叉口新城吾悦广场【1001-1】号商铺,"Wi-Fi,Wi-Fi"
杨浦吉浦湾餐厅,上海市,上海吉浦路323号12-A室,"Wi-Fi,Wi-Fi,点唱机,点唱机,手机点餐,手机点餐"
杨浦吉浦湾餐厅,上海市,上海吉浦路323号12-A室,"Wi-Fi,Wi-Fi,点唱机,点唱机,手机点餐,手机点餐"
颐高上海街餐厅,临沂市,沂蒙路颐高上海街购物广场一层L1-31A铺位,"24小时,24小时,店内参观,店内参观,手机点餐,手机点餐"
临港万达餐厅,上海市,上海临港新片区鸿音路2555号1层1012B、1013号商铺,"Wi-Fi,Wi-Fi,点唱机,点唱机,手机点餐,手机点餐"
临港万达餐厅,上海市,上海临港新片区鸿音路2555号1层1012B、1013号商铺,"Wi-Fi,Wi-Fi,点唱机,点唱机,手机点餐,手机点餐"
虹桥机场T1出发餐厅,上海市,上海虹桥1号航站楼出发禁区D005店铺,
联华餐厅餐厅,洛阳市,城关镇杜康大道与隆盛路交叉口上海联华超市一楼,"手机点餐,手机点餐"
颐高上海街餐厅,临沂市,沂蒙路颐高上海街购物广场一层L1-31A铺位,"24小时,24小时,店内参观,店内参观,手机点餐,手机点餐"
联华餐厅餐厅,洛阳市,城关镇杜康大道与隆盛路交叉口上海联华超市一楼,"手机点餐,手机点餐"
虹桥机场T1出发餐厅,上海市,上海虹桥1号航站楼出发禁区D005店铺,
太仓五洋餐厅,苏州市,城厢镇上海东路五洋广场77号2幢101室、2幢201室,"Wi-Fi,Wi-Fi,点唱机,点唱机,店内参观,店内参观"
塘沽上海道餐厅餐厅,天津市,上海道888号,"Wi-Fi,Wi-Fi,手机点餐,手机点餐"
太仓五洋餐厅,苏州市,城厢镇上海东路五洋广场77号2幢101室、2幢201室,"Wi-Fi,Wi-Fi,点唱机,点唱机,店内参观,店内参观"
塘沽上海道餐厅餐厅,天津市,上海道888号,"Wi-Fi,Wi-Fi,手机点餐,手机点餐"
新嘉松餐厅,上海市,嘉松中路5555号上海奥特莱斯品牌直销广场17幢C2区1层、2层,"手机点餐,手机点餐"
新嘉松餐厅,上海市,嘉松中路5555号上海奥特莱斯品牌直销广场17幢C2区1层、2层,"手机点餐,手机点餐"
杨高南路餐厅,上海市,上海高青路2671号一层 1-08铺位,"Wi-Fi,Wi-Fi,手机点餐,手机点餐"
御上海餐厅,上海市,梅家浜路1207号103室,"手机点餐,手机点餐"
杨高南路餐厅,上海市,上海高青路2671号一层 1-08铺位,"Wi-Fi,Wi-Fi,手机点餐,手机点餐"
御上海餐厅,上海市,梅家浜路1207号103室,"手机点餐,手机点餐"
上海肯德基有限公司鄂尔多斯餐厅,上海市,鄂尔多斯路98弄82号南大尚优玛特一层107铺位,
上海肯德基有限公司新宝翔餐厅,上海市,丰翔路3168号南翔太茂B区118B商铺及119商铺,
上海肯德基有限公司爱博家园餐厅,上海市,申滨路929号层1F-12室,
上海肯德基有限公司曹安大润发餐厅,上海市,真新新村街道新郁路807、817-819、835号,
上海肯德基有限公司幸福里餐厅,上海市,陈春路109号101单元,
上海肯德基有限公司爱博家园餐厅,上海市,申滨路929号层1F-12室,
上海肯德基有限公司天纳园区餐厅,上海市,建韵路500号3号楼C101室、3115室、3114室,
上海肯德基有限公司中成智谷餐厅,上海市,长江路258号2幢B3号楼102号、103号一层,
上海肯德基有限公司嘉定万创餐厅,上海市,安智路155号一层118室,
上海肯德基有限公司曹安大润发餐厅,上海市,真新新村街道新郁路807、817-819、835号,
上海肯德基有限公司幸福里餐厅,上海市,陈春路109号101单元,
上海肯德基有限公司共富大酒餐厅,上海市,共富路266-2号一层,
上海肯德基有限公司常青大厦餐厅,上海市,奉炮公路450号一层副楼139-140,
上海肯德基有限公司嘉定大众餐厅,上海市,于田路7号一期辅楼1楼,"手机点餐,手机点餐"
上海肯德基有限公司盛夏路餐厅,上海市,盛夏路1059-1、1059-2号一层,
上海肯德基有限公司中成智谷餐厅,上海市,长江路258号2幢B3号楼102号、103号一层,
上海肯德基有限公司常青大厦餐厅,上海市,奉炮公路450号一层副楼139-140,
上海肯德基有限公司嘉定万创餐厅,上海市,安智路155号一层118室,
上海肯德基有限公司新宝翔餐厅,上海市,丰翔路3168号南翔太茂B区118B商铺及119商铺,
上海肯德基有限公司盛夏路餐厅,上海市,盛夏路1059-1、1059-2号一层,
上海肯德基有限公司嘉定大众餐厅,上海市,于田路7号一期辅楼1楼,"手机点餐,手机点餐"
上海肯德基有限公司天纳园区餐厅,上海市,建韵路500号3号楼C101室、3115室、3114室,
上海肯德基有限公司汇源路餐厅,上海市,汇源路388弄嘉隆国际广场2号楼1层,
上海肯德基有限公司阳光天地餐厅,上海市,张扬北路3169号1层,
上海肯德基有限公司正泰启迪餐厅,上海市,思贤路3655号34幢东庭地下一层113室,
上海肯德基有限公司汇源路餐厅,上海市,汇源路388弄嘉隆国际广场2号楼1层,
上海肯德基有限公司阳光天地餐厅,上海市,张扬北路3169号1层,
上海肯德基有限公司正泰启迪餐厅,上海市,思贤路3655号34幢东庭地下一层113室,
上海肯德基有限公司共富大酒餐厅,上海市,共富路266-2号一层,
新苏站餐厅,苏州市,苏站路27号苏州站北广场北出站口东侧B1层出租车上车点方向,"礼品卡,手机点餐,手机点餐"
吴中越溪餐厅,苏州市,苏州吴中区越溪镇吴中大道1109号“南苏州生活广场”E幢B馆华润万家超市旁,"24小时,24小时,Wi-Fi,Wi-Fi,店内参观,店内参观,礼品卡"
吴中车站（苏州吴中汽车车站旁）餐厅,苏州市,吴中经济开发区广建路10号苏州吴中汽车客运站一二层,"24小时,24小时,Wi-Fi,Wi-Fi,店内参观,店内参观,礼品卡"
园区车坊餐厅,苏州市,苏州工业园区普惠路1089号（星湖财富广场）2幢107-108室一二层和2幢106的二层商铺,"24小时,24小时,Wi-Fi,Wi-Fi,点唱机,点唱机,店内参观,店内参观,礼品卡"
苏站精选餐厅,苏州市,苏站路27号苏州站2F层候车室2A检票口（高铁动车南京方向）,"精选店,精选店,手机点餐,手机点餐"
苏州桥(紫金大厦一层）餐厅,北京市,万泉河路68号紫金大厦一层北侧,"24小时,24小时,Wi-Fi,Wi-Fi,店内参观,店内参观,礼品卡"
苏州街餐厅,北京市,海淀南路13号楼亿方大厦一、二层,"Wi-Fi,Wi-Fi,礼品卡"
苏州路餐厅,乌鲁木齐市,北京南路28号家乐福苏州路购物中心一层肯德基餐厅,"Wi-Fi,Wi-Fi,点唱机,点唱机,店内参观,店内参观,礼品卡"
南京肯德基有限公司沭阳大润发餐厅,宿迁市,沭阳县上海南路与苏州西路交汇处,"24小时,24小时,Wi-Fi,Wi-Fi,点唱机,点唱机,店内参观,店内参观,礼品卡"
苏州路餐厅餐厅,青岛市,青岛苏州路与济南路交叉口西南角被称为“大润发超市”地块上部分一层,"店内参观,店内参观,礼品卡"
木渎影视城餐厅,苏州市,木渎镇金山南路228号苏州国际影视娱乐城3号楼1层,"Wi-Fi,Wi-Fi,店内参观,店内参观,礼品卡"
木渎花样城餐厅,苏州市,苏州吴中区木渎镇中山东路98号花样城1号楼,"24小时,24小时,Wi-Fi,Wi-Fi,点唱机,点唱机,礼品卡"
湖东邻里餐厅,苏州市,苏州工业园区星湖街178号1幢101室,"Wi-Fi,Wi-Fi,店内参观,店内参观,礼品卡"
双湖邻里餐厅,苏州市,苏州工业园区企鸿路18号双湖邻里中心1F,"24小时,24小时,Wi-Fi,Wi-Fi,店内参观,店内参观,礼品卡"
苏站南广场精选餐厅,苏州市,苏州火车站到达层南侧出站口,"Wi-Fi,Wi-Fi,精选店,精选店,手机点餐,手机点餐"
苏州中心餐厅,苏州市,苏州中心4楼肯德基,"Wi-Fi,Wi-Fi"
城市生活广场餐厅,苏州市,平泷路251号苏州城市生活广场一层102号、103号,"Wi-Fi,Wi-Fi,店内参观,店内参观"
丰隆中心餐厅,苏州市,苏州钟园路788号丰隆城市中心一层,"Wi-Fi,Wi-Fi,店内参观,店内参观"
苏州北站餐厅餐厅,苏州市,铁路苏州北站站外商业街区SZB-B1-02铺位,"Wi-Fi,Wi-Fi,点唱机,点唱机"
苏州星光耀餐厅,苏州市,虎池路1583号1楼,"Wi-Fi,Wi-Fi,店内参观,店内参观,手机点餐,手机点餐"
现代传媒广场负1楼67952920餐厅,苏州市,苏州大道东265号苏州现代传媒广场一楼铺位号L107/L108负,"Wi-Fi,Wi-Fi,点唱机,点唱机"
园区凤凰广场餐厅,苏州市,苏州工业园区凤凰广场餐厅,"24小时,24小时,Wi-Fi,Wi-Fi"
相城梦多多餐厅,苏州市,元和街道润元路366号苏州梦多多小镇一层L1016、L1017号,"24小时,24小时,Wi-Fi,Wi-Fi"
阜宁凤凰餐厅,盐城市,苏州路999号凤凰阜宁文化广场一楼1F-03号,"Wi-Fi,Wi-Fi"
阜宁凤凰餐厅,盐城市,苏州路999号凤凰阜宁文化广场一楼1F-03号,"Wi-Fi,Wi-Fi"
传媒广场一楼66580176餐厅,苏州市,工业园区苏州大道东265号苏州现代传媒广场一楼铺位号L107/L108,"Wi-Fi,Wi-Fi,点唱机,点唱机,精选店,精选店"
传媒广场一楼66580176餐厅,苏州市,工业园区苏州大道东265号苏州现代传媒广场一楼铺位号L107/L108,"Wi-Fi,Wi-Fi,点唱机,点唱机,精选店,精选店"
森林世界北极熊餐厅,苏州市,高新区象山路南白鹤山路西苏州乐园森林世界北极熊补给站,
森林世界北极熊餐厅,苏州市,高新区象山路南白鹤山路西苏州乐园森林世界北极熊补给站,
凌上新街坊餐厅餐厅,东营市,苏州路2889号凌上新街坊2-107号商铺,"点唱机,点唱机"
TY临时-苏州肯德基市场餐厅,盐城市,,"店内参观,店内参观,手机点餐,手机点餐"
TY临时-苏州肯德基市场餐厅,盐城市,,"店内参观,店内参观,手机点餐,手机点餐"
苏州肯德基有限公司爷爷自在茶吴中越溪餐厅,苏州市,越溪街道吴中大道1109号12幢,
苏州肯德基有限公司东台八佰伴餐厅,盐城市,望海东路58号一层L1020号商铺,
苏州肯德基有限公司东台八佰伴餐厅,盐城市,望海东路58号一层L1020号商铺,
苏州肯德基有限公司吴江七都餐厅,苏州市,七都镇妆桥路131号一层,
苏州肯德基有限公司爷爷自在茶吴中越溪餐厅,苏州市,越溪街道吴中大道1109号12幢,
苏州肯德基有限公司吴江七都餐厅,苏州市,七都镇妆桥路131号一层,
苏州肯德基有限公司常熟尚湖餐厅,苏州市,尚湖镇永升（安）路65号星荟生活广场,
苏州肯德基有限公司常熟尚湖餐厅,苏州市,尚湖镇永升（安）路65号星荟生活广场,
小什字街餐厅,沈阳市,小东路9-2号沈阳大悦城D馆一层,"Wi-Fi,Wi-Fi,礼品卡"
沈阳机场T3餐厅,沈阳市,机场路199号桃仙国际机场T3航站楼2楼,"Wi-Fi,Wi-Fi,精选店,精选店,礼品卡"
沈阳站前餐厅,沈阳市,胜利南街2号,礼品卡
铁西广场餐厅,沈阳市,铁西广场沈阳华润置地广场万象汇,礼品卡
沈阳建筑大学肯德基餐厅,沈阳市,浑南区浑南东路9号沈阳建筑大学校内商业街29号,"精选店,精选店"
招商花园餐厅,沈阳市,浑南区营盘北街7号沈阳招商花园城购物中心地下一层,"Wi-Fi,Wi-Fi"
沈阳天地餐厅,沈阳市,皇姑区北陵大街17号沈阳天地一楼,"Wi-Fi,Wi-Fi,点唱机,点唱机"
工业大学外卖点餐厅,沈阳市,市辖区经济技术开发区沈辽西路111号沈阳工业大学,"Wi-Fi,Wi-Fi,精选店,精选店"
桃仙T3二餐厅,沈阳市,机场路199号沈阳桃仙国际机场 T3航站楼3层,"Wi-Fi,Wi-Fi,精选店,精选店"
桃仙T3二餐厅,沈阳市,机场路199号沈阳桃仙国际机场 T3航站楼3层,"Wi-Fi,Wi-Fi,精选店,精选店"
辽中服务区（沈阳方向）餐厅,沈阳市,辽中县京哈高速公路沿线辽中服务区南侧一层（沈阳方向）,"Wi-Fi,Wi-Fi,店内参观,店内参观"
辽中服务区（沈阳方向）餐厅,沈阳市,辽中县京哈高速公路沿线辽中服务区南侧一层（沈阳方向）,"Wi-Fi,Wi-Fi,店内参观,店内参观"
航空航天大学餐厅,沈阳市,道义南大街37-16号沈阳航空航天大学南生活区浴池楼一层4号网点,"精选店,精选店,手机点餐,手机点餐"
沈阳理工大学餐厅,沈阳市,"南屏中路6号沈阳理工大学文体中心A馆113,114","精选店,精选店"
沈阳理工大学餐厅,沈阳市,"南屏中路6号沈阳理工大学文体中心A馆113,114","精选店,精选店"
沈阳财务餐厅,沈阳市,沈阳财务,
沈阳财务餐厅,沈阳市,沈阳财务,
百胜餐饮(沈阳)有限公司黑大丽泽园餐厅,哈尔滨市,学府路74号黑龙江大学C区丽泽园4层421、422号铺位,"手机点餐,手机点餐"
百胜餐饮(沈阳)有限公司黑大丽泽园餐厅,哈尔滨市,学府路74号黑龙江大学C区丽泽园4层421、422号铺位,"手机点餐,手机点餐"
百胜餐饮(沈阳)有限公司鞍山佳梦达餐厅,鞍山市,鞍千路651号地上一层,
百胜餐饮(沈阳)有限公司凤凰城餐厅,齐齐哈尔市,凤凰大街与明海公路交汇肯德基餐厅,
沈阳师范大学餐厅,沈阳市,沈北新区黄河北大街253号1层,"手机点餐,手机点餐"
百胜餐饮(沈阳)有限公司华宇城餐厅,四平市,师大西街和市府路交会处华宇城营销中心1层,
沈阳师范大学餐厅,沈阳市,沈北新区黄河北大街253号1层,"手机点餐,手机点餐"
百胜餐饮(沈阳)有限公司万科溪望餐厅,长春市,和安街与大学城路交会处万科溪望营销中心1层,
百胜餐饮(沈阳)有限公司华宇城餐厅,四平市,师大西街和市府路交会处华宇城营销中心1层,
百胜餐饮(沈阳)有限公司深哈产业园餐厅,哈尔滨市,深哈合作区14#楼,
百胜餐饮(沈阳)有限公司万科溪望餐厅,长春市,和安街与大学城路交会处万科溪望营销中心1层,
龙湖天街餐厅,沈阳市,沈中大街与高深东路交汇处沈阳浑南天街B1F层位编号A-B1F-01,"手机点餐,手机点餐"
百胜餐饮(沈阳)有限公司深哈产业园餐厅,哈尔滨市,深哈合作区14#楼,
百胜餐饮(沈阳)有限公司凤凰城餐厅,齐齐哈尔市,凤凰大街与明海公路交汇肯德基餐厅,
龙湖天街餐厅,沈阳市,沈中大街与高深东路交汇处沈阳浑南天街B1F层位编号A-B1F-01,"手机点餐,手机点餐"
柏林餐厅,石家庄市,石家庄新华区中华北大街和联盟路交叉口西北角金柏林商城一层,"Wi-Fi,Wi-Fi,点唱机,点唱机,店内参观,店内参观,礼品卡"
天山餐厅,石家庄市,石家庄学院对面一二楼,"Wi-Fi,Wi-Fi,点唱机,点唱机,礼品卡"
晋州信誉楼餐厅,石家庄市,石家庄世纪大道东侧中兴路南侧信誉楼商场1层,"Wi-Fi,Wi-Fi,店内参观,店内参观"
石家庄万象城餐厅餐厅,石家庄市,华润万象城7楼肯德基（中华大街与中山路交口）,"Wi-Fi,Wi-Fi"
石家庄赵县餐厅餐厅,石家庄市,永通路北侧哲恩教育大厦一层001商铺,"Wi-Fi,Wi-Fi,点唱机,点唱机"
石家庄尚峰汇餐厅,石家庄市,友谊南大街西新石中路北尚峰汇大厦一层 S102号商铺,"Wi-Fi,Wi-Fi,店内参观,店内参观"
东广场地铁北外卖点餐厅,石家庄市,石家庄站地铁2号线北扶梯口,"Wi-Fi,Wi-Fi"
石家庄北国奥莱甜品餐厅,石家庄市,铜冶镇南铜冶村、南甘子村北国奥特莱斯1层肯德基餐厅门前,"店内参观,店内参观"
石家庄正定北国餐厅餐厅,石家庄市,恒山西路南侧、成德街西侧106号正定北国商城一层001号铺位。,"点唱机,点唱机,店内参观,店内参观"
东广场地铁南外卖点餐厅,石家庄市,石家庄站地铁2号线南扶梯口,"Wi-Fi,Wi-Fi"
东广场地铁北外卖点餐厅,石家庄市,石家庄站地铁2号线北扶梯口,"Wi-Fi,Wi-Fi"
中石油石家庄1号餐厅餐厅,石家庄市,建华北大街与和平路交叉口西北角,
中石油石家庄1号餐厅餐厅,石家庄市,建华北大街与和平路交叉口西北角,
石家庄正定北国餐厅餐厅,石家庄市,恒山西路南侧、成德街西侧106号正定北国商城一层001号铺位。,"点唱机,点唱机,店内参观,店内参观"
东广场地铁南外卖点餐厅,石家庄市,石家庄站地铁2号线南扶梯口,"Wi-Fi,Wi-Fi"
石家庄北国奥莱甜品餐厅,石家庄市,铜冶镇南铜冶村、南甘子村北国奥特莱斯1层肯德基餐厅门前,"店内参观,店内参观"
石家庄天河悦城餐厅餐厅,石家庄市,北二环以北、景源街以东、景悦街6号天河广场026号商铺,"Wi-Fi,Wi-Fi,点唱机,点唱机,店内参观,店内参观"
石家庄天河悦城餐厅餐厅,石家庄市,北二环以北、景源街以东、景悦街6号天河广场026号商铺,"Wi-Fi,Wi-Fi,点唱机,点唱机,店内参观,店内参观"
石家庄省二院餐厅,石家庄市,和平西路80号综合楼001号商铺,"Wi-Fi,Wi-Fi,点唱机,点唱机"
石家庄省二院餐厅,石家庄市,和平西路80号综合楼001号商铺,"Wi-Fi,Wi-Fi,点唱机,点唱机"
行唐未来广场餐厅,石家庄市,石家庄玉城东大街未来广场肯德基,"手机点餐,手机点餐"
石家庄人民医院餐厅餐厅,石家庄市,建华南大街人民医院建华院区门诊一层002号休闲区域,"Wi-Fi,Wi-Fi,点唱机,点唱机,店内参观,店内参观,手机点餐,手机点餐"
行唐未来广场餐厅,石家庄市,石家庄玉城东大街未来广场肯德基,"手机点餐,手机点餐"
