晋中灵石新建东餐厅餐厅,晋中市,新建街贵都生活广场（原名称：贵都财富中心）一层,"Wi-Fi,Wi-Fi,点唱机,点唱机,店内参观,店内参观,手机点餐,手机点餐"
吉盛餐厅,长春市,东盛大街交吉林大路西南亚泰广场1-2层,礼品卡
吉林中康餐厅,吉林市,吉林大街309号,"Wi-Fi,Wi-Fi,礼品卡"
吉林大街餐厅,吉林市,吉林大街518号万达广场肯德基,"Wi-Fi,Wi-Fi,点唱机,点唱机,店内参观,店内参观"
嘎吉林广场餐厅,拉萨市,城东区城关花园拉堆路和西二路交汇处嘎吉林广场商铺1F-24号,"手机点餐,手机点餐"
嘎吉林广场餐厅,拉萨市,城东区城关花园拉堆路和西二路交汇处嘎吉林广场商铺1F-24号,"手机点餐,手机点餐"
九江信华餐厅,九江市,信华城市广场一楼,"Wi-Fi,Wi-Fi,礼品卡"
九江共青餐厅,九江市,高尔夫大道与富华大道交汇处天虹商场一楼,"Wi-Fi,Wi-Fi"
九江长江大道餐厅,九江市,九江长江大道联盛快乐城一楼肯德基,
铜锣湾广场餐厅,九江市,浔南大道铜锣湾广场大润发一楼（九江汽车站斜对面）,"Wi-Fi,Wi-Fi,店内参观,店内参观"
九江万达餐厅,九江市,德化路万达广场一楼肯德基,"点唱机,点唱机"
九江信基餐厅,佛山市,九江镇大正路信基广场肯德基,"24小时,24小时,Wi-Fi,Wi-Fi,点唱机,点唱机,店内参观,店内参观"
九江快乐城1楼肯德基甜品站餐厅,九江市,“联盛九江快乐城”中庭---1楼甜品站,"店内参观,店内参观"
揭阳临江北餐厅,揭阳市,仁港商业街,"24小时,24小时,Wi-Fi,Wi-Fi,点唱机,点唱机,店内参观,店内参观,礼品卡"
美佳乐DT餐厅,揭阳市,洪阳镇城徽往揭阳方向50米处美佳乐购物广场W001商铺一、二层,"24小时,24小时,Wi-Fi,Wi-Fi,店内参观,店内参观,礼品卡,礼品卡"
揭阳万达广场餐厅,揭阳市,榕东南厝村临江南路揭阳万达广场内的1025号商铺,"Wi-Fi,Wi-Fi,点唱机,点唱机,店内参观,店内参观"
揭阳万达广场餐厅,揭阳市,榕东南厝村临江南路揭阳万达广场内的1025号商铺,"Wi-Fi,Wi-Fi,点唱机,点唱机,店内参观,店内参观"
怀府餐厅,焦作市,焦作沁阳市怀府中路玫瑰城A栋一、二层,"Wi-Fi,Wi-Fi,店内参观,店内参观,礼品卡"
焦作万达餐厅,焦作市,丰收路民主南路交叉口东南角的万达广场一层,"Wi-Fi,Wi-Fi,点唱机,点唱机,店内参观,店内参观"
荆州东门餐厅,荆州市,荆沙路与江津路交汇处东升广场一楼（东门外）,"Wi-Fi,Wi-Fi,点唱机,点唱机,店内参观,店内参观,礼品卡"
荆州红门路餐厅,荆州市,江津中路204号大润发超一楼,"Wi-Fi,Wi-Fi,点唱机,点唱机,店内参观,店内参观,礼品卡"
荆州北京路餐厅,荆州市,北京中路227号肯德基餐厅,"点唱机,点唱机,礼品卡"
荆州月亮湾餐厅,荆州市,沙市中商百货一楼北京路中路173号,"点唱机,点唱机,礼品卡"
荆州美佳华餐厅,荆州市,美佳华A128号,"Wi-Fi,Wi-Fi,点唱机,点唱机,礼品卡"
荆州万达餐厅,荆州市,北京西路508号万达广场一层1001A,"点唱机,点唱机,礼品卡"
荆州新天地餐厅,荆州市,塔桥路新天地上街5号楼一层120号肯德基,"Wi-Fi,Wi-Fi,点唱机,点唱机,店内参观,店内参观"
荆州吾悦餐厅,荆州市,荆沙大道新城吾悦广场1001号,"点唱机,点唱机"
荆州吾悦餐厅,荆州市,荆沙大道新城吾悦广场1001号,"点唱机,点唱机"
荆州绿地餐厅,荆州市,庄王大道西侧（荆北新区高铁站站前广场区域）荆州绿地城际空间站项目一层,"点唱机,点唱机"
荆州绿地餐厅,荆州市,庄王大道西侧（荆北新区高铁站站前广场区域）荆州绿地城际空间站项目一层,"点唱机,点唱机"
荆州人信汇餐厅,荆州市,北京中路239号人信汇一层123号商铺,"24小时,24小时,点唱机,点唱机,手机点餐,手机点餐"
荆州人信汇餐厅,荆州市,北京中路239号人信汇一层123号商铺,"24小时,24小时,点唱机,点唱机,手机点餐,手机点餐"
锦州万达餐厅,锦州市,松山新区科技路21号万达广场一楼3号门,"Wi-Fi,Wi-Fi"
锦州万达甜品站餐厅,锦州市,松山新区科技路21号万达广场4楼出万达影院左走30米,
荆门万达餐厅,荆门市,深圳大道以南象山大道以西万达广场,"Wi-Fi,Wi-Fi,点唱机,点唱机"
荆门摩尔城餐厅餐厅,荆门市,长宁大道57号荆门摩尔城,"Wi-Fi,Wi-Fi,点唱机,点唱机"
荆门掇刀万达餐厅,荆门市,虎牙关大道5号掇刀万达一层2号门（星球）,"Wi-Fi,Wi-Fi,点唱机,点唱机"
荆门掇刀万达餐厅,荆门市,虎牙关大道5号掇刀万达一层2号门（星球）,"Wi-Fi,Wi-Fi,点唱机,点唱机"
吉安庐陵餐厅,吉安市,文山路与凤凰路交汇处（庐陵商业大世界）,"点唱机,点唱机,店内参观,店内参观,礼品卡"
吉安人民广场餐厅,吉安市,广场西路新世界广场1F,"Wi-Fi,Wi-Fi,点唱机,点唱机,店内参观,店内参观,礼品卡,手机点餐,手机点餐"
瓷都新天地餐厅,景德镇市,景德镇新村西路口瓷都新天地肯德基,"点唱机,点唱机,店内参观,店内参观,礼品卡"
晋城国贸餐厅,晋城市,红星街与泽州路交叉口国贸大厦B国贸大厦座,"24小时,24小时,Wi-Fi,Wi-Fi,店内参观,店内参观,礼品卡"
晋城星悦城餐厅,晋城市,北石店镇畅安路星悦城购物中心一层,"Wi-Fi,Wi-Fi,店内参观,店内参观"
晋城凤展餐厅,晋城市,中国新市西街858号凤展购物广场一层,"Wi-Fi,Wi-Fi,店内参观,店内参观"
晋城万达餐厅,晋城市,"白水东街万达广场【1032,1033】号商铺","店内参观,店内参观,手机点餐,手机点餐"
晋城万达餐厅,晋城市,"白水东街万达广场【1032,1033】号商铺","店内参观,店内参观,手机点餐,手机点餐"
佳木斯万达餐厅,佳木斯市,郊区光复西路1801号佳木斯万达广场一层肯德基,"Wi-Fi,Wi-Fi,店内参观,店内参观"
佳木斯万达餐厅,佳木斯市,郊区光复西路1801号佳木斯万达广场一层肯德基,"Wi-Fi,Wi-Fi,店内参观,店内参观"
佳木斯万达餐厅,佳木斯市,郊区光复西路1801号佳木斯万达广场一层肯德基,"Wi-Fi,Wi-Fi,店内参观,店内参观"
佳木斯万达餐厅,佳木斯市,郊区光复西路1801号佳木斯万达广场一层肯德基,"Wi-Fi,Wi-Fi,店内参观,店内参观"
酒泉肃州餐厅,酒泉市,鼓楼东方广场一、二层肯德基餐厅,"Wi-Fi,Wi-Fi,店内参观,店内参观,礼品卡"
酒泉万达餐厅,酒泉市,世纪大道45号万达广场1号门,
东寺街餐厅,昆明市,昆明东寺街中段东方广场A座一二层,"24小时,24小时,Wi-Fi,Wi-Fi,店内参观,店内参观,礼品卡"
长水机场餐厅,昆明市,昆明长水国际机场候机楼负一楼,"24小时,24小时,礼品卡"
启鸿假日餐厅,昆明市,昆明假日城市小区一层,"24小时,24小时,Wi-Fi,Wi-Fi,点唱机,点唱机,店内参观,店内参观,礼品卡"
昆明高铁到达餐厅,昆明市,昆明呈贡高铁站,"Wi-Fi,Wi-Fi"
机场安检内餐厅,昆明市,昆明长水国际机场安检区内,"24小时,24小时"
机场精选出发浮岛F4层餐厅,昆明市,昆明长水机场出发层浮岛4F,"24小时,24小时,精选店,精选店"
昆明南站出发层餐厅,昆明市,昆明南站J20号商铺,
昆明火车站餐厅,昆明市,昆明站站房东侧一楼11号商铺,"Wi-Fi,Wi-Fi,精选店,精选店"
西咸吾悦餐厅,西安市,市辖区西咸新区沣东新城昆明路与天台路十字吾悦广场,"Wi-Fi,Wi-Fi"
高铁到达外卖点餐厅,昆明市,昆明南站-10.5米出站层C9-2号商铺,"Wi-Fi,Wi-Fi,店内参观,店内参观"
昆明大悦城餐厅,昆明市,西山区昆明大悦城购物中心B1-063号店铺,"Wi-Fi,Wi-Fi,点唱机,点唱机,店内参观,店内参观"
富康城餐厅,昆明市,进出口加工区浦发路与龙辉路交叉口富康城昆明经开中心一号门一楼,"Wi-Fi,Wi-Fi,点唱机,点唱机"
呈贡吾悦餐厅,昆明市,彩云中路与祥和路交叉路口处昆明呈贡吾悦广场,"Wi-Fi,Wi-Fi,店内参观,店内参观"
首创奥莱餐厅,昆明市,昌源北路1390号昆明首创奥莱商业中心2号门一层F1-B30号铺,"Wi-Fi,Wi-Fi,店内参观,店内参观"
首创奥莱餐厅,昆明市,昌源北路1390号昆明首创奥莱商业中心2号门一层F1-B30号铺,"Wi-Fi,Wi-Fi,店内参观,店内参观"
呈贡吾悦餐厅,昆明市,彩云中路与祥和路交叉路口处昆明呈贡吾悦广场,"Wi-Fi,Wi-Fi,店内参观,店内参观"
叁伍壹壹餐厅,西安市,昆明路2号叁伍壹壹TFEP一层B1-01,"手机点餐,手机点餐"
叁伍壹壹餐厅,西安市,昆明路2号叁伍壹壹TFEP一层B1-01,"手机点餐,手机点餐"
昆明宜家餐厅,昆明市,小屯路与王筇路交叉口昆明宜家家居商场L1层01A22号,"Wi-Fi,Wi-Fi,店内参观,店内参观,精选店,精选店,手机点餐,手机点餐"
昆明宜家餐厅,昆明市,小屯路与王筇路交叉口昆明宜家家居商场L1层01A22号,"Wi-Fi,Wi-Fi,店内参观,店内参观,精选店,精选店,手机点餐,手机点餐"
昆明肯德基有限公司大理爱琴海餐厅,大理白族自治州,太和街道兴盛北路与鸡足山路交叉口爱琴海购物公园1F层LG1013+LG1015号商铺,"手机点餐,手机点餐"
昆明肯德基有限公司大理爱琴海餐厅,大理白族自治州,太和街道兴盛北路与鸡足山路交叉口爱琴海购物公园1F层LG1013+LG1015号商铺,"手机点餐,手机点餐"
昆明肯德基有限公司玉溪万达餐厅,玉溪市,聂耳路与棋阳路交叉路口玉溪万达F1层1020号铺,
昆明肯德基有限公司祥云中央广场餐厅,大理白族自治州,清红路与龙翔路交叉口龙翔·中央广场3栋1层3-S101、3-S102、3-S-103、3-S-105、3-S106-2、3-S-107-2号商铺,
昆明肯德基有限公司邦盛广场 餐厅,昆明市,广福路与彩云北路交叉口邦盛财富广场一层（F1-049）,
昆明肯德基有限公司邦盛广场 餐厅,昆明市,广福路与彩云北路交叉口邦盛财富广场一层（F1-049）,
昆明肯德基有限公司玉溪万达餐厅,玉溪市,聂耳路与棋阳路交叉路口玉溪万达F1层1020号铺,
昆明肯德基有限公司祥云中央广场餐厅,大理白族自治州,清红路与龙翔路交叉口龙翔·中央广场3栋1层3-S101、3-S102、3-S-103、3-S-105、3-S106-2、3-S-107-2号商铺,
开封万达餐厅,开封市,郑开大道与一大街交汇处西南角万达广场1030商铺,"24小时,24小时,Wi-Fi,Wi-Fi,点唱机,点唱机,店内参观,店内参观"
新天津小白楼餐厅,天津市,小白楼1902欧式风情街的开封道 44-54号,"Wi-Fi,Wi-Fi"
新天津小白楼餐厅,天津市,小白楼1902欧式风情街的开封道 44-54号,"Wi-Fi,Wi-Fi"
准噶尔餐厅,克拉玛依市,克拉玛依准噶尔路73号一层肯德基,"Wi-Fi,Wi-Fi,点唱机,点唱机,店内参观,店内参观,礼品卡"
克拉玛依领先餐厅,克拉玛依市,市辖区迎宾路克拉玛依领先城天百时尚购物中心一期1层,"Wi-Fi,Wi-Fi,点唱机,点唱机,店内参观,店内参观,手机点餐,手机点餐"
克拉玛依领先餐厅,克拉玛依市,市辖区迎宾路克拉玛依领先城天百时尚购物中心一期1层,"Wi-Fi,Wi-Fi,点唱机,点唱机,店内参观,店内参观,手机点餐,手机点餐"
新疆肯德基有限公司克拉玛依汇嘉餐厅,克拉玛依市,幸福路以南，胜利路以西汇嘉时代购物中心1F-03号,
新疆肯德基有限公司克拉玛依汇嘉餐厅,克拉玛依市,幸福路以南，胜利路以西汇嘉时代购物中心1F-03号,
喀什环疆肯德基餐厅餐厅,喀什地区,人民西路环疆新世界百货一楼B07-09厅,
乌鲁木齐喀什西路餐厅,乌鲁木齐市,市辖区经济技术开发区（）喀什西路499号新和居小区龙海综合楼1层,"Wi-Fi,Wi-Fi,点唱机,点唱机"
乌鲁木齐喀什西路餐厅,乌鲁木齐市,市辖区经济技术开发区（）喀什西路499号新和居小区龙海综合楼1层,"Wi-Fi,Wi-Fi,点唱机,点唱机"
兰州西客站餐厅,兰州市,兰州西客站候车层商业夹层肯德基餐厅,"Wi-Fi,Wi-Fi,店内参观,店内参观,礼品卡,手机点餐,手机点餐"
兰州城关餐厅,兰州市,城关区天水北路兰州城关万达广场二、三层肯德基餐厅,"Wi-Fi,Wi-Fi,点唱机,点唱机,店内参观,店内参观,礼品卡,手机点餐,手机点餐"
兰州东岗餐厅,兰州市,东岗东路1469号东欧国际儿童城肯德基餐厅,"Wi-Fi,Wi-Fi,店内参观,店内参观"
兰州中心餐厅,兰州市,七里河区西津西路16号兰州中心购物广场一层肯德基,"Wi-Fi,Wi-Fi,手机点餐,手机点餐"
兰州新区奥莱餐厅,兰州市,永登县经十路以东、纬十路以南、经十一路以西、纬八路以北的奥特莱斯广场,"Wi-Fi,Wi-Fi,点唱机,点唱机,店内参观,店内参观"
白银世贸餐厅,白银市,广场北路与兰州路交叉口国芳百货一层肯德基,"Wi-Fi,Wi-Fi,店内参观,店内参观,精选店,精选店"
兰州砂之船餐厅,兰州市,北滨河西路1258号,"Wi-Fi,Wi-Fi,店内参观,店内参观"
兰州东方红7F甜品站餐厅,兰州市,广场南路4号国芳百货购物广场7层,"Wi-Fi,Wi-Fi"
兰州碧桂园餐厅,兰州市,青白石街道青白石路剑桥郡25幢1层101号,"Wi-Fi,Wi-Fi,店内参观,店内参观"
兰州陇能餐厅,兰州市,盐场路陇能家园A区一楼肯德基餐厅,"Wi-Fi,Wi-Fi,点唱机,点唱机,店内参观,店内参观"
兰州雁北餐厅,兰州市,高新雁北路1575号-1层肯德基,"Wi-Fi,Wi-Fi,点唱机,点唱机,店内参观,店内参观"
兰州杉杉奥莱餐厅,兰州市,新石沟村（碧桂园西侧）兰州杉杉奥特莱斯购物广场1层,"Wi-Fi,Wi-Fi,点唱机,点唱机,店内参观,店内参观"
兰州国贸餐厅,兰州市,庆阳路326号南关国芳G99购物公园1层,"Wi-Fi,Wi-Fi,店内参观,店内参观,手机点餐,手机点餐"
兰州金城中心餐厅,兰州市,西固中路118号虹盛·假日熊猫购物公园一层,"Wi-Fi,Wi-Fi,店内参观,店内参观"
兰州中海餐厅,兰州市,蓝科路697号一层肯德基餐厅,"Wi-Fi,Wi-Fi,点唱机,点唱机,店内参观,店内参观"
兰州航天餐厅,兰州市,南昌路167号一层肯德基,"Wi-Fi,Wi-Fi,店内参观,店内参观"
兰州国贸餐厅,兰州市,庆阳路326号南关国芳G99购物公园1层,"Wi-Fi,Wi-Fi,店内参观,店内参观,手机点餐,手机点餐"
兰州东方红B1餐厅,兰州市,皋兰路5号地下1层国芳商业广场,"Wi-Fi,Wi-Fi,点唱机,点唱机,店内参观,店内参观"
兰州金城中心餐厅,兰州市,西固中路118号虹盛·假日熊猫购物公园一层,"Wi-Fi,Wi-Fi,店内参观,店内参观"
兰州中海餐厅,兰州市,蓝科路697号一层肯德基餐厅,"Wi-Fi,Wi-Fi,点唱机,点唱机,店内参观,店内参观"
兰州航天餐厅,兰州市,南昌路167号一层肯德基,"Wi-Fi,Wi-Fi,店内参观,店内参观"
兰州东方红B1餐厅,兰州市,皋兰路5号地下1层国芳商业广场,"Wi-Fi,Wi-Fi,点唱机,点唱机,店内参观,店内参观"
兰州中心甜品站餐厅,兰州市,西津西路16号兰州中心购物广场负一层,
兰州中心甜品站餐厅,兰州市,西津西路16号兰州中心购物广场负一层,
兰州杉杉奥莱餐厅,兰州市,新石沟村（碧桂园西侧）兰州杉杉奥特莱斯购物广场1层,"Wi-Fi,Wi-Fi,点唱机,点唱机,店内参观,店内参观"
兰州费家营餐厅,兰州市,费家营十字东南角安宁西路381号飞天世纪新城商住小区临街商铺1层,"Wi-Fi,Wi-Fi,点唱机,点唱机,店内参观,店内参观,手机点餐,手机点餐"
兰州费家营餐厅,兰州市,费家营十字东南角安宁西路381号飞天世纪新城商住小区临街商铺1层,"Wi-Fi,Wi-Fi,点唱机,点唱机,店内参观,店内参观,手机点餐,手机点餐"
兰州东湖广场餐厅,兰州市,南昌路6号,"Wi-Fi,Wi-Fi,店内参观,店内参观,手机点餐,手机点餐"
兰州东湖广场餐厅,兰州市,南昌路6号,"Wi-Fi,Wi-Fi,店内参观,店内参观,手机点餐,手机点餐"
兰州兰石餐厅,兰州市,兰石豪布斯卡项目13#地块珍园住宅小区底商1层,"Wi-Fi,Wi-Fi,点唱机,点唱机,店内参观,店内参观"
兰州兰石餐厅,兰州市,兰石豪布斯卡项目13#地块珍园住宅小区底商1层,"Wi-Fi,Wi-Fi,点唱机,点唱机,店内参观,店内参观"
兰州西站餐厅,兰州市,西站西路44号西部广场一层,"Wi-Fi,Wi-Fi,点唱机,点唱机,店内参观,店内参观,手机点餐,手机点餐"
兰州西站餐厅,兰州市,西站西路44号西部广场一层,"Wi-Fi,Wi-Fi,点唱机,点唱机,店内参观,店内参观,手机点餐,手机点餐"
兰州佛慈大街餐厅,兰州市,层01铺佛慈大街68号佛慈1929文创广场1号楼（原药厂7幢）一,"Wi-Fi,Wi-Fi,店内参观,店内参观,手机点餐,手机点餐"
兰州佛慈大街餐厅,兰州市,层01铺佛慈大街68号佛慈1929文创广场1号楼（原药厂7幢）一,"Wi-Fi,Wi-Fi,店内参观,店内参观,手机点餐,手机点餐"
兰州九州餐厅,兰州市,九州东环路268号金岛大厦一层4号商铺,
兰州安宁东路餐厅,兰州市,安宁东路文化教育广场1层,"店内参观,店内参观,手机点餐,手机点餐"
兰州安宁东路餐厅,兰州市,安宁东路文化教育广场1层,"店内参观,店内参观,手机点餐,手机点餐"
兰州九州餐厅,兰州市,九州东环路268号金岛大厦一层4号商铺,
兰州万达茂餐厅,兰州市,南滨河中路1399号,
兰州万达茂餐厅,兰州市,南滨河中路1399号,
兰州肯德基有限公司安宁吾悦餐厅,兰州市,银安路248号兰州安宁吾悦广场1层,
兰州肯德基有限公司安宁吾悦餐厅,兰州市,银安路248号兰州安宁吾悦广场1层,
临沂新城吾悦餐厅,临沂市,新城吾悦广场1069号商铺,"Wi-Fi,Wi-Fi,店内参观,店内参观"
临沂北城万达餐厅,临沂市,8191167--北城万达广场内一楼南端（2号门正对过）,"Wi-Fi,Wi-Fi,店内参观,店内参观"
临沂华润万象汇餐厅,临沂市,华润万象汇第三层L363号商铺,"Wi-Fi,Wi-Fi,店内参观,店内参观"
临沂滨河万达餐厅餐厅,临沂市,蒙山大道与滨河路交汇处西南角1021号,"Wi-Fi,Wi-Fi,点唱机,点唱机"
临沂滨河万达餐厅餐厅,临沂市,蒙山大道与滨河路交汇处西南角1021号,"Wi-Fi,Wi-Fi,点唱机,点唱机"
临沂滨河万达餐厅餐厅,临沂市,蒙山大道与滨河路交汇处西南角1021号,"Wi-Fi,Wi-Fi,点唱机,点唱机"
临沂滨河万达餐厅餐厅,临沂市,蒙山大道与滨河路交汇处西南角1021号,"Wi-Fi,Wi-Fi,点唱机,点唱机"
临沂大学餐厅,临沂市,滨河路北段西侧、临沂大学东门华仁高尔夫商业广场一层,"Wi-Fi,Wi-Fi"
廊坊万达餐厅,廊坊市,新华路万达广场一层,"Wi-Fi,Wi-Fi,礼品卡"
廊坊大厂餐厅餐厅,廊坊市,大厂县大安东街与荣昌北路交口华联香百超市一层,"Wi-Fi,Wi-Fi,点唱机,点唱机,店内参观,店内参观"
廊坊香河物美餐厅餐厅,廊坊市,新华大街与五一路交口，香河物美超市一层铺位号1520-F1-A001-1和1520-F1-A001-2，二层铺位号1520-F2-B030,"Wi-Fi,Wi-Fi,点唱机,点唱机"
廊坊荣盛餐厅餐厅,廊坊市,市辖区艺术大道以北建设路以东祥云道荣盛华府14号楼商城荣盛超市一层,"Wi-Fi,Wi-Fi,店内参观,店内参观"
廊坊香河永泰路餐厅餐厅,廊坊市,永泰路北段西侧香河华香商贸有限公司超市一层东门主入口北侧（北1号）,"Wi-Fi,Wi-Fi,点唱机,点唱机"
廊坊阳光馨苑餐厅餐厅,廊坊市,常甫路97号一层,"Wi-Fi,Wi-Fi,店内参观,店内参观"
廊坊阳光馨苑餐厅餐厅,廊坊市,常甫路97号一层,"Wi-Fi,Wi-Fi,店内参观,店内参观"
廊坊荣盛餐厅餐厅,廊坊市,市辖区艺术大道以北建设路以东祥云道荣盛华府14号楼商城荣盛超市一层,"Wi-Fi,Wi-Fi,店内参观,店内参观"
廊坊香河永泰路餐厅餐厅,廊坊市,永泰路北段西侧香河华香商贸有限公司超市一层东门主入口北侧（北1号）,"Wi-Fi,Wi-Fi,点唱机,点唱机"
廊坊建国道餐厅餐厅,廊坊市,建国道与新开路交口肯德基,"Wi-Fi,Wi-Fi,点唱机,点唱机"
廊坊建国道餐厅餐厅,廊坊市,建国道与新开路交口肯德基,"Wi-Fi,Wi-Fi,点唱机,点唱机"
廊坊廊和坊DT餐厅,廊坊市,开发区华祥路与金源道交口以东廊和坊·金融街-金融·家项目商业街H座1层,"Wi-Fi,Wi-Fi,店内参观,店内参观"
廊坊廊和坊DT餐厅,廊坊市,开发区华祥路与金源道交口以东廊和坊·金融街-金融·家项目商业街H座1层,"Wi-Fi,Wi-Fi,店内参观,店内参观"
廊坊永兴路餐厅,廊坊市,广阳区华夏.幸福城润园16-6-01的房屋,"Wi-Fi,Wi-Fi"
廊坊永兴路餐厅,廊坊市,广阳区华夏.幸福城润园16-6-01的房屋,"Wi-Fi,Wi-Fi"
廊坊北凤道DT餐厅,廊坊市,塞纳荣府102#-101号商业用房1 层,"Wi-Fi,Wi-Fi,店内参观,店内参观,精选店,精选店"
廊坊永清明珠餐厅餐厅,廊坊市,永清镇北关村文苑路西侧明珠购物广场F01号1层,"Wi-Fi,Wi-Fi,点唱机,点唱机,手机点餐,手机点餐"
廊坊永清明珠餐厅餐厅,廊坊市,永清镇北关村文苑路西侧明珠购物广场F01号1层,"Wi-Fi,Wi-Fi,点唱机,点唱机,手机点餐,手机点餐"
廊坊固安宝德餐厅餐厅,廊坊市,新中东街北侧新昌东街南侧、万隆财富广场商业A01,"Wi-Fi,Wi-Fi,点唱机,点唱机,手机点餐,手机点餐"
廊坊固安宝德餐厅餐厅,廊坊市,新中东街北侧新昌东街南侧、万隆财富广场商业A01,"Wi-Fi,Wi-Fi,点唱机,点唱机,手机点餐,手机点餐"
廊坊潮白馨居餐厅餐厅,廊坊市,侯谭线潮白馨居S1-1-11003号商铺,"手机点餐,手机点餐"
廊坊馨语星苑餐厅餐厅,廊坊市,光明西道馨语星苑商业2C-3-101-A,"手机点餐,手机点餐"
廊坊馨语星苑餐厅餐厅,廊坊市,光明西道馨语星苑商业2C-3-101-A,"手机点餐,手机点餐"
廊坊潮白馨居餐厅餐厅,廊坊市,侯谭线潮白馨居S1-1-11003号商铺,"手机点餐,手机点餐"
廊坊元辰超市餐厅餐厅,廊坊市,爱民西道86号A01号铺位,"Wi-Fi,Wi-Fi,店内参观,店内参观,手机点餐,手机点餐"
廊坊元辰超市餐厅餐厅,廊坊市,爱民西道86号A01号铺位,"Wi-Fi,Wi-Fi,店内参观,店内参观,手机点餐,手机点餐"
廊坊狮子城餐厅餐厅,廊坊市,狮子城黄金城道步行街S3号楼113、114、115号商铺,"点唱机,点唱机,手机点餐,手机点餐"
廊坊狮子城餐厅餐厅,廊坊市,狮子城黄金城道步行街S3号楼113、114、115号商铺,"点唱机,点唱机,手机点餐,手机点餐"
中石油廊坊餐厅餐厅,廊坊市,万庄石油基地京廊路中国石油第九十七加油站内,
中石油廊坊餐厅餐厅,廊坊市,万庄石油基地京廊路中国石油第九十七加油站内,
廊坊万庄中石油97站餐厅,廊坊市,万庄石油基地京廊路中国石油第九十七加油站内,"手机点餐,手机点餐"
廊坊万庄中石油97站餐厅,廊坊市,万庄石油基地京廊路中国石油第九十七加油站内,"手机点餐,手机点餐"
站前广场餐厅,南昌市,洛阳路70号1-2层,"Wi-Fi,Wi-Fi,点唱机,点唱机,礼品卡"
龙门站餐厅,洛阳市,洛阳洛龙区龙门高铁站候车厅一楼西侧,"Wi-Fi,Wi-Fi,礼品卡"
洛阳正大餐厅,洛阳市,洛龙区正大广场2F08商铺和2F42商铺,"Wi-Fi,Wi-Fi"
中石化洛阳瀛洲路餐厅餐厅,洛阳市,瀛洲路与洛宜路交叉口加油站站内,"点唱机,点唱机"
中石化洛阳瀛洲路餐厅餐厅,洛阳市,瀛洲路与洛宜路交叉口加油站站内,"点唱机,点唱机"
柳州2餐厅,上海市,南站站层（商铺号C102）,"Wi-Fi,Wi-Fi,点唱机,点唱机,礼品卡,溯源"
天润餐厅餐厅,南京市,柳州东路1号天润广场一层52417900,"24小时,24小时,Wi-Fi,Wi-Fi,点唱机,点唱机,店内参观,店内参观,礼品卡"
南柳餐厅餐厅,南宁市,宾阳东服务区(东区)往来宾、柳州方向,"Wi-Fi,Wi-Fi,礼品卡"
柳州万达餐厅,柳州市,东环大道256号万达广场内一层的第1021号商铺、二层第2021商铺,"Wi-Fi,Wi-Fi,店内参观,店内参观,礼品卡"
万象城0772-2103039餐厅,柳州市,文昌路17号的柳州华润中心购物中心万象城第B1层B177号商铺,"Wi-Fi,Wi-Fi,店内参观,店内参观"
柳州大江郡餐厅,柳州市,市辖区白沙路2号保利国际中心2号裙楼一层,"Wi-Fi,Wi-Fi,点唱机,点唱机,店内参观,店内参观"
柳州王府井餐厅,柳州市,柳城县文昌路9号东方福来德一期一层,"Wi-Fi,Wi-Fi,店内参观,店内参观"
柳州王府井餐厅,柳州市,柳城县文昌路9号东方福来德一期一层,"Wi-Fi,Wi-Fi,店内参观,店内参观"
柳州高博达餐厅,柳州市,阳和新区古亭片区古山居苑北地块N4、集中商业市场一层,"手机点餐,手机点餐"
柳州高博达餐厅,柳州市,阳和新区古亭片区古山居苑北地块N4、集中商业市场一层,"手机点餐,手机点餐"
六安皖西餐厅,六安市,皖西路与梅山路交汇口新都会广场,"24小时,24小时,Wi-Fi,Wi-Fi,店内参观,店内参观,礼品卡,手机点餐,手机点餐"
六安徽宁记餐厅,六安市,解放路浙东商贸城时代超市,"24小时,24小时,Wi-Fi,Wi-Fi,店内参观,店内参观,礼品卡"
六安万达3334490餐厅,六安市,球拍东路东侧3334490,"店内参观,店内参观"
六安火车站餐厅,六安市,裕安区六安火车站铺位号LA-2F-08,"精选店,精选店"
六安吾悦广场餐厅,六安市,六舒路与吾悦大道交口吾悦广场1001/2001-1号商铺,"Wi-Fi,Wi-Fi,点唱机,点唱机,店内参观,店内参观"
六安吾悦广场餐厅,六安市,六舒路与吾悦大道交口吾悦广场1001/2001-1号商铺,"Wi-Fi,Wi-Fi,点唱机,点唱机,店内参观,店内参观"
六安大润发餐厅,六安市,裕安区人民路与纱厂路交口大润发超市一层&二层,"Wi-Fi,Wi-Fi,店内参观,店内参观,手机点餐,手机点餐"
